skill_name,differentiator_type,notes,source
"Resilience, Flexibility and Agility",both importance and proficiency gap (largest overall),"The single biggest differentiator between growing and declining job roles - ranks higher in both importance and required proficiency for growing roles.",WEF Future of Jobs Report 2025
Programming,importance gap,"Scores higher in importance for growing roles but requires comparatively less proficiency than Technological Literacy - a relatively accessible entry point for career switchers.",WEF Future of Jobs Report 2025
Technological Literacy,importance and proficiency gap,"Differentiates growing from declining roles alongside programming, reflecting deeper technology integration across occupational fields.",WEF Future of Jobs Report 2025
Resource Management and Operations,importance and proficiency gap,"Shows a marked gap in both dimensions between growing and declining jobs.",WEF Future of Jobs Report 2025
Quality Control,importance and proficiency gap,"Marked gap in both dimensions within growing vs declining roles - notable because overall market demand for quality control is flat-to-declining, yet it still differentiates growing roles specifically.",WEF Future of Jobs Report 2025
Analytical Thinking,importance gap (top 5) and proficiency gap (#6),"Completes the top-5 importance-gap list between growing and declining jobs; also WEF's #1 core skill overall today (70% of employers).",WEF Future of Jobs Report 2025
